title,url,date,start_time,end_time,image_url,location,recurrence,category,details,source
Alien: Romulus in IMAX!,N/A,,,,https://www.chattanoogapulse.com/downloads/30682/download/ALN-TF-RainElevator%20%281%29.jpg?cb=152e292048143728eaa94c7cddb2e831&w=220&h=,Tennessee Aquarium IMAX 3D Theater,N/A,['Film'],"The sci-fi/horror-thriller takes the phenomenally successful “Alien” franchise back to its roots: While scavenging the deep ends of a derelict space station, a group of young space colonizers come face to face with the most terrifying life form i... Read more",Chattanooga Pulse
Chickamauga Dam Lock Kayak Tour,N/A,2024-08-20,,,https://www.chattanoogapulse.com/downloads/30593/download/PXL_20240802_155527261%7E3.jpg?cb=acf96a4abe66f86623600a790aa0db53&w=220&h=,Tennessee Riverpark (Hubert Fry Center Oval),N/A,"['Education & Learning, Kids & Family, Outdoor']",Kayak through a dam lock on this beginner friendly tour. Learn the history of TVA and flood damage in the Tennessee Valley! Read more,Chattanooga Pulse
Joggers & Lagers,N/A,,,,https://www.chattanoogapulse.com/downloads/16190/download/joggers%20%26%20lagers.png?cb=ccf918643a4c2d1a569ebfe82f3ddd7c&w=220&h=,Chattanooga Brewing Company,N/A,"['Outdoor, This & That']","Lace-up your sneaks and join us for a fun and FREE 5K every Tuesday before Brewga! We will start at the brewery, run 1.5m along the Riverwalk, and then make our way back to enjoy a Burger + Beer for just $10! Read more",Chattanooga Pulse
Paths to Pints along the Riverwalk,N/A,2024-08-20,18:30,,https://www.chattanoogapulse.com/downloads/16001/download/Paths%20to%20Pints.png?cb=7f42636cc48cbabbf35f99d0f4b8e3ae&w=220&h=,The Tap House,N/A,"['Food & Drink, Outdoor']","Run, walk or just stroll with The Tap House! Choose between 1, 3, and 5 mile trail options along the Riverwalk. Every fitness level is welcome, we're all winners here! 
Every Tuesday meet at The Tap House, and we will take off at 6:30pm. Read more",Chattanooga Pulse
Danimal And Friends,N/A,,,,https://www.chattanoogapulse.com/downloads/16361/download/Danimal%20And%20Friends%202.png?cb=ef6c5023aa32382083cfe862b4bbe0ea&w=220&h=,Backstage Bar,N/A,['Concerts & Live Music'],"Tuesday nights are always jumping on The Back Porch on Station Street with Danimal Pinson, Jessica Nunn, Ian Asmussen and friends. Read more",Chattanooga Pulse
Introduction to Calm Abiding Meditation,N/A,,,,https://www.chattanoogapulse.com/downloads/29818/download/IMG_2882.jpeg?cb=b0051075fdfe7f7f4641797a5610fde5&w=220&h=,St Andrews Center,N/A,"['Education & Learning, Health & Wellness']","A 10-week course in learning Calm-Abiding meditation in a Tibetan Buddhist tradition, but suitable for non-Buddhists who want to learn to develop more calm and focus. Tuition is by donation. Read more",Chattanooga Pulse
Bat Cave Kayak Tour with Chattanooga Guided Adventures,N/A,,,,https://www.chattanoogapulse.com/downloads/30592/download/PXL_20240317_231122463.jpg?cb=dc76234db6bf6ac8c662f89b5fa96df7&w=220&h=,Nickajack Bat Cave Maple View Recreation Area,N/A,"['Education & Learning, Kids & Family, Outdoor']","Book a guided kayak tour to see thousands of endangered bats, learn bat facts, and how to help bat populations! Read more",Chattanooga Pulse
Alien: Romulus in IMAX!,N/A,,,,https://www.chattanoogapulse.com/downloads/30682/download/ALN-TF-RainElevator%20%281%29.jpg?cb=152e292048143728eaa94c7cddb2e831&w=220&h=,Tennessee Aquarium IMAX 3D Theater,N/A,['Film'],"The sci-fi/horror-thriller takes the phenomenally successful “Alien” franchise back to its roots: While scavenging the deep ends of a derelict space station, a group of young space colonizers come face to face with the most terrifying life form i... Read more",Chattanooga Pulse
Chickamauga Dam Lock Kayak Tour,N/A,2024-08-21,,,https://www.chattanoogapulse.com/downloads/30593/download/PXL_20240802_155527261%7E3.jpg?cb=acf96a4abe66f86623600a790aa0db53&w=220&h=,Tennessee Riverpark (Hubert Fry Center Oval),N/A,"['Education & Learning, Kids & Family, Outdoor']",Kayak through a dam lock on this beginner friendly tour. Learn the history of TVA and flood damage in the Tennessee Valley! Read more,Chattanooga Pulse
Main Street Farmers Market,N/A,,,,https://www.chattanoogapulse.com/downloads/15605/download/main%20street%20market%20new.png?cb=ae85f55f8c57352275b7718935c83aef&w=220&h=,Chattanooga Brewing Company,N/A,['Markets'],"The Main Street Farmers Market is a producers-only, farmer-run market. It was founded in 2009 to provide a viable marketing outlet for local farmers and food producers and to bring locally grown products to Chattanooga area consumers. Read more",Chattanooga Pulse
Live Music with Eric Kirkendoll,N/A,,,,https://www.chattanoogapulse.com/downloads/18420/download/Eric%20Kirkendoll.png?cb=56fd15f4d079d6cc1ae39c0a10d88195&w=220&h=,1885 Grill,N/A,['Concerts & Live Music'],"Wine Wednesday and Eric Kirkendoll on the 1885 Grill St. Elmo patio… that’s how we do it. Enjoy our Wine Wednesday specials along with $3 glasses of house cabernet and chardonnay, $6 pimento cheese and pita, hummus or smoked salmon dip and half p... Read more",Chattanooga Pulse
Fleet Feet x Oddstory Pub Run,N/A,,,,https://www.chattanoogapulse.com/downloads/18577/download/Pub%20Run.png?cb=adfa6e4260dd70031c50bc38ec6f0462&w=220&h=,OddStory Brewing Co.,N/A,['Outdoor'],"Come run with us at Oddstory Brewing Co. This will become a weekly Wednesday night run beginning this week. Clear your schedule, hold all calls and get your run on! Pint night prices for all runners. Read more",Chattanooga Pulse
Board Game Night,N/A,,,,https://www.chattanoogapulse.com/downloads/16188/download/Board%20Game%20Night.png?cb=1a9eb7353456712bd23305b4fe023bea&w=220&h=,Barley Chattanooga,N/A,['This & That'],Weekly game night at Barley! Experienced and new gamers both very welcome! Read more,Chattanooga Pulse
Bat Cave Kayak Tour with Chattanooga Guided Adventures,N/A,,,,https://www.chattanoogapulse.com/downloads/30592/download/PXL_20240317_231122463.jpg?cb=dc76234db6bf6ac8c662f89b5fa96df7&w=220&h=,Nickajack Bat Cave Maple View Recreation Area,N/A,"['Education & Learning, Kids & Family, Outdoor']","Book a guided kayak tour to see thousands of endangered bats, learn bat facts, and how to help bat populations! Read more",Chattanooga Pulse
Josey Clay,N/A,,,,https://www.chattanoogapulse.com/downloads/22296/download/josey-clay.jpeg?cb=70f3445dfcbc192a438b4654248f1f92&w=220&h=,Doc Holidays,N/A,"['Concerts & Live Music, Food & Drink']","Brought up in a church and family who always sings and plays instruments in worship, Josey Clay began writing, singing, and playing guitar at 12 years old. “The Great State of Dickson Tennessee” was home until he picked up his life and moved to C... Read more",Chattanooga Pulse
Alien: Romulus in IMAX!,N/A,,,,https://www.chattanoogapulse.com/downloads/30682/download/ALN-TF-RainElevator%20%281%29.jpg?cb=152e292048143728eaa94c7cddb2e831&w=220&h=,Tennessee Aquarium IMAX 3D Theater,N/A,['Film'],"The sci-fi/horror-thriller takes the phenomenally successful “Alien” franchise back to its roots: While scavenging the deep ends of a derelict space station, a group of young space colonizers come face to face with the most terrifying life form i... Read more",Chattanooga Pulse
Chickamauga Dam Lock Kayak Tour,N/A,2024-08-22,,,https://www.chattanoogapulse.com/downloads/30593/download/PXL_20240802_155527261%7E3.jpg?cb=acf96a4abe66f86623600a790aa0db53&w=220&h=,Tennessee Riverpark (Hubert Fry Center Oval),N/A,"['Education & Learning, Kids & Family, Outdoor']",Kayak through a dam lock on this beginner friendly tour. Learn the history of TVA and flood damage in the Tennessee Valley! Read more,Chattanooga Pulse
"Toddler Time at Downtown Monday, Thursday and Saturday 11am",N/A,N/A,N/A,N/A,N/A,Downtown Library,N/A,N/A,Toddler Time is a 30-minute action-packed informal learning program for children ages 18 to 36 months.,Chatt Library
Full Steam Ahead South Chatt,N/A,N/A,N/A,N/A,N/A,South Chattanooga Library,N/A,N/A,Full STEAM Ahead is a program designed for kids in Kindergarten through 3rd grade.,Chatt Library
Eastgate Authors,N/A,N/A,N/A,N/A,N/A,Eastgate Library,N/A,N/A,"Join the Eastgate Authors, a group of 3rd-8th graders and library staff, who meet weekly to develop creative writing skills and share their work",Chatt Library
STEAM-Powered Fun Downtown,N/A,N/A,N/A,N/A,N/A,Downtown Library,N/A,N/A,Join the Tween Staff at the Downtown Branch on Thursdays for weekly STEAM-powered fun just for 4th - 8th Graders!,Chatt Library
Toddler Time at Downtown Tuesday 10am,N/A,N/A,N/A,N/A,N/A,Downtown Library,N/A,N/A,Toddler Time is a 30-minute action-packed informal learning program for children ages 18 to 36 months.,Chatt Library
Baby Bounce at Eastgate Tuesday 10am,N/A,N/A,N/A,N/A,N/A,Eastgate Library,N/A,N/A,Baby Bounce is a 30-minute program for parents and caregivers of tiny tots aged 1 day to 18 months.,Chatt Library
Preschool Storytime at Northgate Tuesday 10am,N/A,N/A,N/A,N/A,N/A,Northgate Library,N/A,N/A,Preschool Storytime is a 45-minute program for children ages 3 to 5 years old and their favorite adult.,Chatt Library
Preschool Storytime at Northgate Tuesday 11am,N/A,N/A,N/A,N/A,N/A,Northgate Library,N/A,N/A,Preschool Storytime is a 45-minute program for children ages 3 to 5 years old and their favorite adult.,Chatt Library
Baby Bounce at Downtown Tuesday 12pm,N/A,N/A,N/A,N/A,N/A,Downtown Library,N/A,N/A,Baby Bounce is a 30-minute program for parents and caregivers of tiny tots aged 1 day to 18 months.,Chatt Library
Full Steam Ahead Eastgate,N/A,N/A,N/A,N/A,N/A,Eastgate Library,N/A,N/A,Full STEAM Ahead is a program designed for kids in Kindergarten through 3rd grade.,Chatt Library
STEAM-Powered Fun Eastgate,N/A,N/A,N/A,N/A,N/A,Eastgate Library,N/A,N/A,Join the Tween Staff for weekly STEAM-powered fun just for 4th - 8th Graders!,Chatt Library
Teen Volunteer Orientation,N/A,N/A,N/A,N/A,N/A,Downtown Library,N/A,N/A,"Are you between the ages of 10-18 and interested in volunteering? We would love to have you join us! First, you must attend one of our teen volunteer orientation sessions. We have two Volunteer Orientation dates coming up: Saturday, August 17, 11 AM- 12 PM Tuesday, August 20, 4:30-5:30 PM Fill out the RSVP to […]",Chatt Library
Toddler Time at Northgate Wednesday 10am,N/A,N/A,N/A,N/A,N/A,Northgate Library,N/A,N/A,Toddler Time is a 30-minute action-packed informal learning program for children ages 18 to 36 months.,Chatt Library
Toddler Time at Eastgate Wednesday 10am,N/A,N/A,N/A,N/A,N/A,Eastgate Library,N/A,N/A,Toddler Time is a 30-minute action-packed informal learning program for children ages 18 to 36 months.,Chatt Library
Outdoor Storytime with South Chatt,N/A,N/A,N/A,N/A,N/A,Frederick's Park,N/A,N/A,Outdoor Storytime with South Chatt is a 30-minute storytime for children ages 0-5 and their grownups.,Chatt Library
Ribbon Cutting for Acme Fusion Cafe,N/A,N/A,N/A,N/A,N/A,12p Ribbon Cutting for Acme Fusion Cafe,12p Ribbon Cutting for Acme Fusion Cafe,['N/A'],N/A,Chattanooga Chamber
Downtown Council,N/A,N/A,N/A,N/A,N/A,7:30a Downtown Council,7:30a Downtown Council,['N/A'],N/A,Chattanooga Chamber
Ooltewah/Collegedale Council Coffee,N/A,N/A,N/A,N/A,N/A,8:30a Ooltewah/Collegedale Council Coffee,8:30a Ooltewah/Collegedale Council Coffee,['N/A'],N/A,Chattanooga Chamber
Tropical Smoothie Cafe,N/A,N/A,N/A,N/A,N/A,9a Tropical Smoothie Cafe,9a Tropical Smoothie Cafe,['N/A'],N/A,Chattanooga Chamber
East Ridge Council Meeting,N/A,N/A,N/A,N/A,N/A,11:30a East Ridge Council Meeting,11:30a East Ridge Council Meeting,['N/A'],N/A,Chattanooga Chamber
Nightfall 2024,N/A,2024-08-23,,,https://cdn.prod.website-files.com/59935d164668fb0001206326/6650756de1e1f46876dfaf36_nightfall.png,Miller Plaza & Miller Park,N/A,['Community & Festivals'],"The free Nightfall concert series, produced by Chattanooga Presents, will be held each Friday night from May 24 through August 30 2024 - rai...",CHA Guide Things To Do
Riverfront Nights,N/A,2024-08-24,,,https://cdn.prod.website-files.com/59935d164668fb0001206326/66506dc8c3a254ae79e4be1c_riverfrontnigghts.png,Ross’s Landing,N/A,['Community & Festivals'],Join Friends of the Festival for “Fourteen Saturdays of Summer” from Memorial Day to Labor Day weekend at Ross’s Landing for FREE live music...,CHA Guide Things To Do
OPEN SCRIBZ OPEN MIC,N/A,2024-08-24,,,https://cdn.prod.website-files.com/59935d164668fb0001206326/66bf203e3a064e934931b375_SCRIBZ.png,Songbirds,N/A,['Community & Festivals'],"Featured performers include Big Fitz, Deep Thought the Lyricist out of Madison, WI , other poets and YOU!...",CHA Guide Things To Do
Rail & Hops Brewers Festival,N/A,2024-08-24,,,https://cdn.prod.website-files.com/59935d164668fb0001206326/66bf21a47e9d8ee0951452d7_railhops.png,Chattanooga Choo Choo - Glenn Miller Gardens,N/A,['Community & Festivals'],"August 24, 2024, | 12:00 p - 4:00 p | 21+ events, including designated driver....",CHA Guide Things To Do
SHADES OF POETRY ARTIST TALK AND PERFORMANCE SHOWCASE,N/A,2024-08-25,,,https://cdn.prod.website-files.com/59935d164668fb0001206326/66bf2101b6c02dbd023a7157_artist%20talk.png,RISE Chattanooga,N/A,['Community & Festivals'],Immerse yourself in the profound influence of Baldwin's work as it resonates through the powerful jazz compositions ....,CHA Guide Things To Do
